qid,reviewer_name,review_date,primary_decision_enum,secondary_tags,legal_source_expected,scorer_expectation,runtime_fix_allowed_if_systemic,manual_residual_accepted_for_internal_eval,manual_residual_accepted_for_productization,notes
CBY-04,Scorer Review,2026-05-03,legal_taxonomy_confirmed,requires_source_identity_design;blocks_internal_eval;blocks_productization,Devlet Arşiv Hizmetleri Hakkında Yönetmelik,Arşiv saklama/ayıklama/devir/imha iş akışı için CB_YONETMELIK ailesindeki Devlet Arşiv Hizmetleri Hakkında Yönetmelik primary source kabul edilmeli; CBK 11 yalnız dayanak/kurumsal supporting source olarak kalmalı ve tek başına primary seçilirse fail etmeli.,yes,no,no,"Yönetmelik 11 sayılı CBK'ya dayanır; operatif saklama, devir, ayıklama ve imha hükümleri yönetmeliktedir. CB_KARARNAME kaynağını CB_YONETMELIK gibi relabel etmek yasak; yalnız sistemik source-selection/source-identity fix yapılabilir."
CBY-06,Scorer Review,2026-05-03,runtime_fix_allowed,requires_corpus_backfill;requires_article_span_materialization;blocks_internal_eval;blocks_productization,"Kamu Kurum ve Kuruluşları Personel Servis Hizmet Yönetmeliği m.11 ek fıkra (03.04.2026/33213, Karar Sayısı 11153)","Scorer m.11'e 03.04.2026 değişikliğiyle eklenen fıkrayı ve fact slotlarını beklemeli: yararlanabilecek çocuk grupları, personel refakati, trafik komisyonu izni ve Okul Servis Araçları Yönetmeliği yükümlülüklerine uygun taşıma.",yes,no,no,Eksik olan kaynak ailesinden çok güncel değişiklik/span ve answer completeness. QID-specific kural değil; 2026 değişikliği corpusa girip amended article span materialize edilirse runtime fix güvenli.
KKY-01,Scorer Review,2026-05-03,legal_taxonomy_confirmed,requires_source_identity_design,Bankaların Bilgi Sistemleri ve Elektronik Bankacılık Hizmetleri Hakkında Yönetmelik (BDDK/Kurum-Kurul Yönetmeliği; benchmark KKY),BDDK kaynaklı bu düzenleme benchmark taxonomy açısından KKY kabul edilmeli. Genel YONETMELIK etiketi hukuken üst kategori olarak yanıltıcı değildir; exact title/issuer/provision doğruysa KKY/YONETMELIK parent-child uyumluluğu scorer tarafından tolere edilmeli.,yes,conditional,conditional,BDDK mevzuat listesinde belge Yönetmelik olarak yer alır; benchmark açısından issuer-based KKY alt ailesine map edilebilir. Sistemik family normalization güvenli; Kurul Kararı ile karıştırılmamalı.
TEB-04,Scorer Review,2026-05-03,scorer_rubric_mismatch,requires_source_identity_design;requires_article_span_materialization,Katma Değer Vergisi Genel Uygulama Tebliği (konsolide metin),KDV tevkifat/iade sorusunda konsolide KDV Genel Uygulama Tebliği primary source kabul edilmeli; seri değişiklik tebliği yerine güncel konsolide metin ve ilgili I/C-2.1.3/iade spanı doğru materialize edilmişse auto-fail olmamalı.,yes,yes,conditional,"Doğru kaynak family TEB. Source identity düzeldikten sonra fail devam ediyorsa scorer/rubric veya materialization mismatch vardır; internal eval için manuel residual kabul edilebilir, productization yalnız doğru current consolidated source ve span gösteriliyorsa kabul edilebilir."
TUZUK-04,Scorer Review,2026-05-03,legal_taxonomy_confirmed,requires_source_identity_design;requires_corpus_backfill;blocks_internal_eval;blocks_productization,6331 sayılı İş Sağlığı ve Güvenliği Kanunu + güncel Radyasyon Güvenliği Yönetmeliği / Radyasyon Tesislerine ve Radyasyon Uygulamalarına İlişkin Yetkilendirmeler Yönetmeliği; mülga Radyasyon Güvenliği Tüzüğü yalnız tarihsel/supporting,2026 current-law sorusunda mülga Radyasyon Güvenliği Tüzüğü tek başına yeterli kabul edilmemeli; güncel 6331/NDK yönetmelikleriyle karşılaştırmalı current-law framing beklenmeli.,yes,no,no,Radyasyon Güvenliği Tüzüğü 28.10.2023/32353 ile kaldırılmıştır; 2026 cevabında tüzük primary current-law source olamaz. Runtime yalnız genel current-law/repealed-source demotion yapabilir; eski tüzük cevabı productization için kabul edilemez.
