qid,expected_family,selected_family,selected_identifier,selected_title,title_only_fallback_used,body_text_available,body_text_length,source_key_collision_detected,corpus_materialization_required_reason,official_source_available,ingestion_required,parser_required,reindex_required,owner,status,selected_document_id,selected_article,source_key_collision_pair,score_0_10_proxy,failure_classes
CBG-04,CB_GENELGE,CB_GENELGE,3 m.0,İş Yerlerinde Psikolojik Tacizin (Mobbing) Önlenmesi ile İlgili,True,False,257,True,source_key_collision_without_family_body_span,yes_if_selected_title_is_official_catalog_row,False,True,True,source_identity+canonical_parser,blocked_by_family_source_key_collision,İş Yerlerinde Psikolojik Tacizin (Mobbing) Önlenmesi ile İlgili,0,3=cb_genelge:is yerlerinde psikolojik tacizin mobbing onlenmesi ile ilgili|cb_kararname:ust kademe kamu yoneticilerinin atanmalarina iliskin usul ve esaslar ile kamu ku,2.50,missing_gold_document_signal | missing_required_content_signal | wrong_document | hallucinated_identifier | partial_grounding_only | insufficient_canonical_span_evidence
CBKAR-08,CB_KARAR,CB_KARAR,9903 m.0,YATIRIMLARDA DEVLET YARDIMLARI HAKKINDA KARAR (KARAR SAYISI: 9903),True,False,197,True,source_key_collision_without_family_body_span,yes_if_selected_title_is_official_catalog_row,False,True,True,source_identity+canonical_parser,blocked_by_family_source_key_collision,YATIRIMLARDA DEVLET YARDIMLARI HAKKINDA KARAR (KARAR SAYISI: 9903),0,9903=cb_karar:yatirimlarda devlet yardimlari hakkinda karar karar sayisi 9903|teblig:garanti belgesi surelerinin uzatilmasina iliskin teblig teblig no trkgm 2006 1,6.80,missing_required_content_signal | partial_grounding_only | insufficient_canonical_span_evidence
KANUN-06,KANUN,KANUN,TTK m.587,TÜRK TİCARET KANUNU,True,False,915,False,title_only_or_unreadable_body,yes_catalog_row_present_but_body_unreadable,True,True,True,corpus_ingestion,text_extraction_repair_required,TÜRK TİCARET KANUNUNUN YÜRÜRLÜKTEN KALDIRILAN HÜKÜMLERİ,511,,7.15,missing_required_content_signal | partial_grounding_only | insufficient_canonical_span_evidence
KHK-05,KHK,KHK,15698 m.0,DEVLET MEMURLARI KANUNU GENEL TEBLİĞİ (Seri No: 161) (666 Sayılı Kanun Hükmünde Kararname Hükümlerine İlişkin),True,True,522,False,body_span_available_but_title_or_article_zero,True,False,True,True,canonical_parser,body_exists_but_article_zero_materialization_required,DEVLET MEMURLARI KANUNU GENEL TEBLİĞİ (Seri No: 161) (666 Sayılı Kanun Hükmünde Kararname Hükümlerine İlişkin),0,,9.10,missing_required_content_signal | partial_grounding_only | insufficient_canonical_span_evidence
TUZUK-05,TUZUK,TUZUK,unknown,GIDA MADDELERİNİN VE UMUMİ SAĞLIĞI İLGİLENDİREN EŞYA VE LEVAZIMIN HUSUSİ VASIFLARINI GÖSTEREN TÜZÜK,True,True,5566,False,body_span_available_but_title_or_article_zero,True,False,True,True,canonical_parser,body_exists_but_article_zero_materialization_required,GIDA MADDELERİNİN VE UMUMİ SAĞLIĞI İLGİLENDİREN EŞYA VE LEVAZIMIN HUSUSİ VASIFLARINI GÖSTEREN TÜZÜK,0,,3.25,missing_gold_document_signal | missing_required_content_signal | wrong_document | partial_grounding_only | insufficient_canonical_span_evidence
YON-04,YONETMELIK,YONETMELIK,unknown,KİŞİSEL VERİLERİ KORUMA KURUMU TEŞKİLAT YÖNETMELİĞİ,True,True,11465,False,body_span_available_but_title_or_article_zero,True,False,True,True,canonical_parser,body_exists_but_article_zero_materialization_required,"KİŞİSEL VERİLERİN SİLİNMESİ, YOK EDİLMESİ VEYA ANONİM HALE GETİRİLMESİ HAKKINDA YÖNETMELİK",0,,7.55,missing_required_content_signal | partial_grounding_only | insufficient_canonical_span_evidence
