qid,expected_source_if_known,official_url_available,raw_file_available,sha256_available,parser_ready,article_boundaries_detectable,source_exists_in_catalog,source_exists_in_milvus,body_span_available,article_span_available,safe_for_shadow_backfill,blocking_reason
KANUN-12,"5651 sayılı Kanun + related secondary regulation",false,false,false,false,true,true,"true_prior",true,true,false,"No Phase 24 official URL/raw/hash packet; legal source chain not confirmed for current residual closure."
KKY-03,"Bankaların Bilgi Sistemleri ve Elektronik Bankacılık Hizmetleri Yönetmeliği + KVKK/public info security source",false,false,false,false,true,true,"true_prior",true,true,false,"No Phase 24 official URL/raw/hash packet; multi-source chain requires legal confirmation."
TUZUK-04,"6331/current İSG regulations + old tüzük comparison",false,false,false,false,true,true,true,true,true,false,"Legal framing unresolved; source acquisition not the first safe action."
TUZUK-05,"Exact valid tüzük hierarchy source requires legal review",false,false,false,false,unknown,unknown,unknown,true,false,false,"Expected source is not safely established; official source and parser boundaries unavailable."
YON-04,"Kişisel Verilerin Silinmesi, Yok Edilmesi veya Anonim Hale Getirilmesi Yönetmeliği + KVKK",false,false,false,false,true,true,"true_prior",true,true,false,"Expected source appears visible in prior reports but no Phase 24 official raw/hash packet is available."
