qid,expected_family,source_key_collision_detected,source_key_collision_keys,source_key_collision_pair,selected_document_id,source_title_claimed,canonical_span_materialization_reason,corpus_materialization_required,insufficient_canonical_span_evidence,score_0_10_proxy
CBG-02,CB_GENELGE,True,26 | 29,26=cb_genelge:yurt disinda yurutulen faaliyetlerde dikkat edilmesi gereken hususlar ile ilgili|cb_karar:4 7 1956 tarihli ve 6772 sayili kanun kapsamina giren kurumlarda calisan isciler; 29=cb_genelge:ulusal akilli sehirler stratejisi ve eylem plani ile ilgili|cb_karar:turkakim kara kismi 2 gaz boru hatti projesi kapsaminda tekirdag ve kirklareli i,Ulusal Akıllı Şehirler Stratejisi ve Eylem Planı ile İlgili,,body_span_available_but_title_or_article_zero,True,True,3.25
CBG-04,CB_GENELGE,True,3,3=cb_genelge:is yerlerinde psikolojik tacizin mobbing onlenmesi ile ilgili|cb_kararname:ust kademe kamu yoneticilerinin atanmalarina iliskin usul ve esaslar ile kamu ku,İş Yerlerinde Psikolojik Tacizin (Mobbing) Önlenmesi ile İlgili,,source_key_collision_without_family_body_span,True,True,2.50
CBKAR-08,CB_KARAR,True,9903,9903=cb_karar:yatirimlarda devlet yardimlari hakkinda karar karar sayisi 9903|teblig:garanti belgesi surelerinin uzatilmasina iliskin teblig teblig no trkgm 2006 1,YATIRIMLARDA DEVLET YARDIMLARI HAKKINDA KARAR (KARAR SAYISI: 9903),,source_key_collision_without_family_body_span,True,True,6.80
KANUN-10,KANUN,True,6183,6183=kanun:amme alacaklarinin tahsil usulu hakkinda kanun|mulga_kanun:amme alacaklarinin tahsil usulu hakkindaki kanunun yururlukten kaldirilmis hukum,AMME ALACAKLARININ TAHSİL USULÜ HAKKINDAKİ KANUNUN YÜRÜRLÜKTEN KALDIRILMIŞ HÜKÜMLERİ,,non_title_body_span_available,False,False,8.92
KANUN-15,KANUN,True,2981,2981=kanun:imar ve gecekondu mevzuatina aykiri yapilara uygulanacak bazi islemler ve 6785 s|mulga_kanun:imar ve gecekondu mevzuatina aykiri yapilara uygulanacak bazi islemler ve 6785 s,İMAR VE GECEKONDU MEVZUATINA AYKIRI YAPILARA UYGULANACAK BAZI İŞLEMLER VE 6785 SAYILI İMAR KANUNUNUN BİR MADDESİNİN DEĞİŞTİRİLMESİ HAKKINDA KANUN,,non_title_body_span_available,False,False,6.05
KANUN-19,KANUN,True,7201,7201=kanun:tebligat kanunu|mulga_kanun:tebligat kanununun yururlukten kaldirilmis hukumleri,TEBLİGAT KANUNUNUN YÜRÜRLÜKTEN KALDIRILMIŞ HÜKÜMLERİ,,non_title_body_span_available,False,False,6.05
